{
  "$schema": "https://json-schema.org/draft/2020-12/schema",
  "title": "플랫폼 공통값",
  "description": "모든 프로젝트가 함께 쓰는 값: 포트 공식, 예약 포트, 루트 도메인, AWS 공통값.",
  "type": "object",
  "required": ["rootDomain", "aws", "portScheme", "reservedPorts"],
  "additionalProperties": false,
  "properties": {
    "$schema": { "type": "string" },
    "rootDomain": { "type": ["string", "null"], "pattern": "^[a-z0-9]([a-z0-9.-]*[a-z0-9])?$", "description": "서비스 루트 도메인. 미정이면 null" },
    "aws": {
      "type": "object",
      "required": ["region", "accountAlias", "sharedPrefix"],
      "additionalProperties": false,
      "properties": {
        "region": { "type": "string", "pattern": "^[a-z]{2}-[a-z]+-\\d$" },
        "accountAlias": { "type": ["string", "null"], "minLength": 1 },
        "sharedPrefix": { "type": ["string", "null"], "pattern": "^[a-z][a-z0-9-]*$" }
      }
    },
    "portScheme": {
      "type": "object",
      "required": ["web", "api", "e2eApi", "vite", "e2eWeb", "db", "maxSlot"],
      "additionalProperties": false,
      "properties": {
        "web": { "type": "integer", "minimum": 1024, "maximum": 65000 },
        "api": { "type": "integer", "minimum": 1024, "maximum": 65000 },
        "e2eApi": { "type": "integer", "minimum": 1024, "maximum": 65000 },
        "vite": { "type": "integer", "minimum": 1024, "maximum": 65000 },
        "e2eWeb": { "type": "integer", "minimum": 1024, "maximum": 65000 },
        "db": { "type": "integer", "minimum": 1024, "maximum": 65000 },
        "maxSlot": { "type": "integer", "minimum": 1, "maximum": 99 }
      }
    },
    "reservedPorts": { "type": "array", "uniqueItems": true, "items": { "type": "integer", "minimum": 1, "maximum": 65535 } }
  }
}
